{
  "schema_version": "2.1.0",
  "mode": "preflight",
  "input_prompt": "Content Ops Goal Q frontend live-publishing readiness polish; frontend UI only plus docs/evidence; readiness summary, lifecycle states, retry states, schedule confirmation; no live publishing activation",
  "resolved_by": "folder_path",
  "action": "resolve",
  "confidence": 0.9,
  "selected_persona": {
    "id": "lina",
    "name": "Lina",
    "role": "Frontend architect and UX owner"
  },
  "backup_persona": {
    "id": "joel",
    "name": "Joel",
    "role": "Design system engineer and frontend backup"
  },
  "conflict_flags": {
    "conflict": false,
    "cross_stream": false,
    "strong_conflict_count": 0
  },
  "touched_streams": [
    "S4"
  ],
  "required_tests": [
    "cd frontend && npm test -- --run",
    "cd frontend && npm run build"
  ],
  "docs_to_open": [
    "docs/workstreams.md",
    "docs/project/feature-ownership-map.md",
    "docs/project/frontend-finished-product-spec.md",
    "docs/design-system.md",
    "docs/project/frontend-spec-review-checklist.md",
    "AGENTS.md",
    "docs/ops/escalation-rules.md"
  ],
  "escalation_decision": {
    "advisory_only": true,
    "required_reviewers": [],
    "reason": "No escalation required by router signals."
  },
  "recommended_report_template": "B",
  "clarifying_question": null,
  "downstream_recommendations": {
    "invoke_scope_gatekeeper": false,
    "invoke_contract_guard": false,
    "invoke_release_readiness": false
  },
  "invoke_scope_gatekeeper": false,
  "evidence": [
    {
      "type": "folder_path",
      "value": "S4:frontend/src",
      "strength": 0.8,
      "source": "paths"
    },
    {
      "type": "domain_keyword",
      "value": "S4:frontend",
      "strength": 0.6,
      "source": "prompt"
    },
    {
      "type": "domain_keyword",
      "value": "S4:ui",
      "strength": 0.6,
      "source": "prompt"
    },
    {
      "type": "changed_file",
      "value": "frontend/src/routes/ContentOpsPage.tsx",
      "strength": 0.7,
      "source": "changed_files"
    },
    {
      "type": "changed_file",
      "value": "frontend/src/lib/contentOpsMock.ts",
      "strength": 0.7,
      "source": "changed_files"
    },
    {
      "type": "changed_file",
      "value": "frontend/src/styles/contentOps.css",
      "strength": 0.7,
      "source": "changed_files"
    },
    {
      "type": "changed_file",
      "value": "frontend/src/routes/__tests__/ContentOpsPage.test.tsx",
      "strength": 0.7,
      "source": "changed_files"
    },
    {
      "type": "changed_file",
      "value": "docs/project/evidence/content-operations/2026-06-10-goal-q-frontend-live-readiness.md",
      "strength": 0.7,
      "source": "changed_files"
    },
    {
      "type": "changed_file",
      "value": "docs/project/content-operations-current-state.md",
      "strength": 0.7,
      "source": "changed_files"
    },
    {
      "type": "changed_file",
      "value": "docs/project/content-operations-implementation-backlog.md",
      "strength": 0.7,
      "source": "changed_files"
    },
    {
      "type": "changed_file",
      "value": "docs/ops/agent-activity-log.md",
      "strength": 0.7,
      "source": "changed_files"
    },
    {
      "type": "changed_file",
      "value": "docs/ops/doc-index.md",
      "strength": 0.7,
      "source": "changed_files"
    },
    {
      "type": "prompt_path",
      "value": "docs/evidence",
      "strength": 0.65,
      "source": "prompt_paths"
    }
  ],
  "decision_trace": "winner=S4; resolved_by=folder_path; score=0.9000; conflicts=0; cross_stream=False; action=resolve; contract_sensitive=False; release_requested=False",
  "rationale": [
    "Selected via folder_path with score 0.90.",
    "Strong streams: S4.",
    "Touched streams: S4."
  ],
  "signals": {
    "explicit_persona_id": null,
    "explicit_stream_ids": [],
    "folder_stream_ids": [
      "S4"
    ],
    "keyword_stream_ids": [
      "S4"
    ],
    "explicit_paths": [],
    "changed_files": [
      "frontend/src/routes/ContentOpsPage.tsx",
      "frontend/src/lib/contentOpsMock.ts",
      "frontend/src/styles/contentOps.css",
      "frontend/src/routes/__tests__/ContentOpsPage.test.tsx",
      "docs/project/evidence/content-operations/2026-06-10-goal-q-frontend-live-readiness.md",
      "docs/project/content-operations-current-state.md",
      "docs/project/content-operations-implementation-backlog.md",
      "docs/ops/agent-activity-log.md",
      "docs/ops/doc-index.md"
    ],
    "prompt_paths": [
      "docs/evidence"
    ],
    "used_git_changed_files": false,
    "folder_matches": {
      "S4": [
        "frontend/src"
      ]
    },
    "keyword_matches": {
      "S4": [
        "frontend",
        "ui"
      ]
    },
    "contract_sensitive": false,
    "contract_reasons": [],
    "release_requested": false,
    "release_keyword": null
  }
}