{
  "schema_version": "2.1.0",
  "mode": "preflight",
  "input_prompt": "Final merge branch readiness for all split tracks",
  "resolved_by": "ask_user_for_clarification",
  "action": "clarify",
  "confidence": 0.0,
  "selected_persona": null,
  "backup_persona": null,
  "conflict_flags": {
    "conflict": false,
    "cross_stream": false,
    "strong_conflict_count": 0
  },
  "touched_streams": [],
  "required_tests": [],
  "docs_to_open": ["AGENTS.md", "docs/workstreams.md"],
  "escalation_decision": {
    "advisory_only": true,
    "required_reviewers": [],
    "reason": "No routing signals were detected."
  },
  "recommended_report_template": "B",
  "clarifying_question": "I could not confidently map this request to a persona. Please provide a stream ID (for example S1-S7), persona name, or concrete folder path.",
  "downstream_recommendations": {
    "invoke_scope_gatekeeper": true,
    "invoke_contract_guard": false,
    "invoke_release_readiness": false
  },
  "invoke_scope_gatekeeper": true,
  "evidence": [
    {
      "type": "changed_file",
      "value": "docs/project/evidence/meta-validation/preflight-2026-02-20/pr-split-plan-2026-02-20.md",
      "strength": 0.7,
      "source": "changed_files"
    },
    {
      "type": "changed_file",
      "value": "docs/project/evidence/meta-validation/preflight-2026-02-20/pr-split-plan-2026-02-20.tsv",
      "strength": 0.7,
      "source": "changed_files"
    }
  ],
  "decision_trace": "no_candidates; reason=no_persona_or_stream_signals; contract_sensitive=False; release_requested=False; action=clarify",
  "rationale": [
    "No persona aliases, stream IDs, folder hints, or keyword hints matched.",
    "Request requires clarification before routing."
  ],
  "signals": {
    "explicit_persona_id": null,
    "explicit_stream_ids": [],
    "folder_stream_ids": [],
    "keyword_stream_ids": [],
    "explicit_paths": [],
    "changed_files": [
      "docs/project/evidence/meta-validation/preflight-2026-02-20/pr-split-plan-2026-02-20.md",
      "docs/project/evidence/meta-validation/preflight-2026-02-20/pr-split-plan-2026-02-20.tsv"
    ],
    "prompt_paths": [],
    "used_git_changed_files": true,
    "contract_sensitive": false,
    "contract_reasons": [],
    "release_requested": false,
    "release_keyword": null
  }
}
